{"$schema":"https://json-schema.org/draft/2020-12/schema","additionalProperties":false,"properties":{"opaque_fixture_id":{"pattern":"^fx-[0-9]{2}$","type":"string"},"padding":{"pattern":"^0*$","type":"string"},"path_contract":{"enum":["P1ConsumerInputV1","MCPTrustPerServerFixtureAdmissibilityV1","BridgeRecoveryReadinessFixtureV1"]},"payload":{"type":"object"},"schema":{"const":"PrimaryFixtureV1"}},"required":["schema","opaque_fixture_id","path_contract","payload","padding"],"type":"object"}
